{
  "schema_version": "2.0.0",
  "numero_processo": "0000001-00.2026.4.00.0001",
  "tipo_acao": "Ação fictícia para teste",
  "assunto": "Manifestação patológica fictícia",
  "juizo": "Juízo fictício",
  "vara": null,
  "subsecao": null,
  "tribunal": "Tribunal fictício",
  "partes": [
    {
      "polo": "ATIVO",
      "nome": "Pessoa Fictícia A",
      "cpf_cnpj": null,
      "qualificacao": null,
      "representantes": [],
      "advogados": []
    }
  ],
  "perito": {
    "nome": "Perito Fictício",
    "profissao": "Engenheiro civil",
    "crea": null,
    "crea_regional": null,
    "ibape": null
  },
  "imovel": {
    "endereco": {
      "logradouro": "Rua Fictícia",
      "numero": "100",
      "complemento": null,
      "bairro": "Bairro Teste",
      "municipio": "Cidade Fictícia",
      "uf": "PE",
      "cep": null
    },
    "matricula": null,
    "area": null,
    "tipologia": "Residencial",
    "empreendimento": null,
    "unidade": null,
    "bloco": null,
    "quadra": null,
    "coordenadas": null,
    "caracterizacao_construtiva": {
      "descricao": null,
      "status_confirmacao": "NAO_CONFIRMADA",
      "fontes": []
    }
  },
  "contrato": null,
  "datas_relevantes": {
    "contrato": null,
    "entrega": null,
    "inicio_utilizacao": null,
    "habite_se": null,
    "surgimento_alegado_manifestacoes": null,
    "primeira_reclamacao": null,
    "primeira_comprovacao_documental": null,
    "ajuizamento": "2026-01-10",
    "nomeacao": null,
    "vistoria": null
  },
  "documentos": [
    {
      "id": "DOC-001",
      "tipo": "Petição",
      "descricao": "Documento fictício",
      "id_processual": null,
      "data": null,
      "autor_origem": "Parte autora fictícia",
      "status": "PRESENTE",
      "paginas": null,
      "observacoes": null
    }
  ],
  "alegacoes": [
    {
      "id": "ALG-001",
      "origem": "Parte autora fictícia",
      "parte": "Pessoa Fictícia A",
      "documento_fonte": "DOC-001",
      "id_processual": null,
      "texto": {
        "conteudo": "A parte alega uma manifestação fictícia.",
        "tipo_registro": "SINTESE_FIEL"
      },
      "manifestacao_alegada": "Manifestação fictícia",
      "causa_alegada": null,
      "consequencia_alegada": null,
      "ambiente_alegado": "Sala",
      "sistema_alegado": null,
      "data_alegada": null,
      "paginas": [{"pagina_pdf": 1, "pagina_documento": 1, "pagina_original": null}],
      "natureza": "ALEGADO_PELA_PARTE",
      "proveniencia": [{"arquivo": "processo-ficticio.pdf", "sha256": "0000000000000000000000000000000000000000000000000000000000000000", "documento_id": "DOC-PJE-001", "id_pje": "900001", "pagina_pdf": 1, "pagina_documento": 1, "pagina_original": null, "trecho": "Trecho fictício", "natureza": "ALEGADO", "metodo_extracao": "TEXTO_DIGITAL", "confianca": {"nivel": "ALTA"}, "status_verificacao": "VERIFICADO"}],
      "observacoes": null,
      "status_verificacao": "NAO_VERIFICADO"
    }
  ],
  "quesitos": [
    {
      "id": "QUE-001",
      "origem": "JUIZO",
      "parte_origem_textual": "Juízo fictício",
      "numero_original": "1",
      "texto_integral": "Descrever a condição observada.",
      "documento_fonte": "DOC-001",
      "id_processual": null,
      "status": "IDENTIFICADO"
    }
  ],
  "decisoes": [],
  "conflitos": [],
  "pendencias": [],
  "objeto_material": {"descricao": "Imóvel fictício", "natureza": "DOCUMENTADO", "documento_fonte": "DOC-001", "proveniencia": [{"arquivo": "processo-ficticio.pdf", "sha256": "0000000000000000000000000000000000000000000000000000000000000000", "documento_id": "DOC-PJE-001", "id_pje": "900001", "pagina_pdf": 1, "pagina_documento": 1, "pagina_original": null, "trecho": "Imóvel fictício", "natureza": "DOCUMENTADO", "metodo_extracao": "TEXTO_DIGITAL", "confianca": {"nivel": "ALTA"}, "status_verificacao": "VERIFICADO"}]},
  "eventos": [],
  "documentos_tecnicos": [],
  "assistentes_tecnicos": [],
  "dados_vistoria_determinados": [],
  "honorarios_prazos": [],
  "proveniencia": [{"arquivo": "processo-ficticio.pdf", "sha256": "0000000000000000000000000000000000000000000000000000000000000000", "documento_id": "DOC-PJE-001", "id_pje": "900001", "pagina_pdf": 1, "pagina_documento": 1, "pagina_original": null, "trecho": "Processo fictício", "natureza": "DOCUMENTADO", "metodo_extracao": "TEXTO_DIGITAL", "confianca": {"nivel": "ALTA"}, "status_verificacao": "VERIFICADO"}]
}
